{
  "opendb_id": "f5b522d1-aeea-4809-ab0b-b57aec6ba58e",
  "series": "Core Ultra 7 200",
  "microarchitecture": "Arrow Lake",
  "coreFamily": "Lion Cove / Skymont",
  "socket": "LGA 1851",
  "cores": {
    "total": 20,
    "performance": 8,
    "efficiency": 12,
    "threads": 20
  },
  "clocks": {
    "performance": {
      "base": 3.9,
      "boost": 5.5
    },
    "efficiency": {
      "base": 3.3,
      "boost": 4.6
    }
  },
  "cache": {
    "l1": "192 KB per P-core, 96KB per E-core",
    "l2": 36,
    "l3": 30
  },
  "specifications": {
    "tdp": 125,
    "ppt": 250,
    "integratedGraphics": {
      "model": "None",
      "baseClock": 0,
      "boostClock": 0,
      "shaderCount": 0
    },
    "eccSupport": false,
    "includesCooler": false,
    "packaging": "Boxed",
    "lithography": "TSMC N3B",
    "simultaneousMultithreading": false,
    "memory": {
      "maxSupport": 256,
      "types": ["DDR5"],
      "channels": 2
    }
  },
  "metadata": {
    "name": "Intel Core Ultra 7 265KF",
    "manufacturer": "Intel",
    "part_numbers": ["BX80768265KF", "Intel Core Ultra 7 265KF"],
    "series": "Core Ultra 7 200",
    "variant": "265KF",
    "releaseYear": 2024
  },
  "general_product_information": {
    "manufacturer_url": "https://www.intel.com/content/www/us/en/products/sku/241062/intel-core-ultra-7-processor-265kf-30m-cache-up-to-5-50-ghz/specifications.html"
  },
  "identifiers": {
    "version": 1,
    "identifiers": [
      {
        "type": "ean",
        "value": "0735858550444",
        "region": "all"
      },
      {
        "type": "ean",
        "value": "5032037281980",
        "region": "all"
      },
      {
        "type": "ean",
        "value": "5032037281997",
        "region": "all"
      },
      {
        "type": "mpn",
        "value": "BX80768265KF",
        "region": "all"
      },
      {
        "type": "mpn",
        "value": "Intel Core Ultra 7 265KF",
        "region": "all"
      },
      {
        "type": "upc",
        "value": "735858550444",
        "region": "all"
      }
    ],
    "retailer_listings": [
      {
        "source": "alternate",
        "channel": "de",
        "source_product_id": "100077067",
        "pricing_enabled": true,
        "verified": false
      },
      {
        "source": "alternate",
        "channel": "es",
        "source_product_id": "100077067",
        "pricing_enabled": true,
        "verified": false
      },
      {
        "source": "alternate",
        "channel": "fr",
        "source_product_id": "100077067",
        "pricing_enabled": true,
        "verified": false
      },
      {
        "source": "alternate",
        "channel": "it",
        "source_product_id": "100077067",
        "pricing_enabled": true,
        "verified": false
      },
      {
        "source": "amazon",
        "channel": "au",
        "source_product_id": "B0DFK2WHF8",
        "pricing_enabled": true,
        "verified": true
      },
      {
        "source": "amazon",
        "channel": "be",
        "source_product_id": "B0DFK2WHF8",
        "pricing_enabled": true,
        "verified": true
      },
      {
        "source": "amazon",
        "channel": "ca",
        "source_product_id": "B0DFK2WHF8",
        "pricing_enabled": true,
        "verified": true
      },
      {
        "source": "amazon",
        "channel": "de",
        "source_product_id": "B0DFK2WHF8",
        "pricing_enabled": true,
        "verified": true
      },
      {
        "source": "amazon",
        "channel": "es",
        "source_product_id": "B0DFK2WHF8",
        "pricing_enabled": true,
        "verified": true
      },
      {
        "source": "amazon",
        "channel": "fr",
        "source_product_id": "B0DFK2WHF8",
        "pricing_enabled": true,
        "verified": true
      },
      {
        "source": "amazon",
        "channel": "ie",
        "source_product_id": "B0DFK2WHF8",
        "pricing_enabled": true,
        "verified": true
      },
      {
        "source": "amazon",
        "channel": "it",
        "source_product_id": "B0DFK2WHF8",
        "pricing_enabled": true,
        "verified": true
      },
      {
        "source": "amazon",
        "channel": "jp",
        "source_product_id": "B0DFK2WHF8",
        "pricing_enabled": true,
        "verified": true
      },
      {
        "source": "amazon",
        "channel": "nl",
        "source_product_id": "B0DFK2WHF8",
        "pricing_enabled": true,
        "verified": true
      },
      {
        "source": "amazon",
        "channel": "pl",
        "source_product_id": "B0DFK2WHF8",
        "pricing_enabled": true,
        "verified": true
      },
      {
        "source": "amazon",
        "channel": "se",
        "source_product_id": "B0DFK2WHF8",
        "pricing_enabled": true,
        "verified": true
      },
      {
        "source": "amazon",
        "channel": "sg",
        "source_product_id": "B0DFK2WHF8",
        "pricing_enabled": true,
        "verified": true
      },
      {
        "source": "amazon",
        "channel": "uk",
        "source_product_id": "B0DFK2WHF8",
        "pricing_enabled": true,
        "verified": true
      },
      {
        "source": "amazon",
        "channel": "us",
        "source_product_id": "B0DFK2WHF8",
        "pricing_enabled": true,
        "verified": true
      },
      {
        "source": "back-to-the-office",
        "channel": "uk",
        "source_product_id": "55306349314430",
        "pricing_enabled": true,
        "verified": false
      },
      {
        "source": "bhphoto",
        "channel": "us",
        "source_product_id": "IN80768265KF",
        "pricing_enabled": true,
        "verified": true
      },
      {
        "source": "box",
        "channel": "uk",
        "source_product_id": "BX80768265KF",
        "pricing_enabled": true,
        "verified": false
      },
      {
        "source": "caseking",
        "channel": "de",
        "source_product_id": "HPIT-837",
        "pricing_enabled": true,
        "verified": false
      },
      {
        "source": "caseking",
        "channel": "es",
        "source_product_id": "BX80768265KF",
        "pricing_enabled": true,
        "verified": false
      },
      {
        "source": "ccl",
        "channel": "uk",
        "source_product_id": "CPU0926",
        "pricing_enabled": true,
        "verified": false
      },
      {
        "source": "cenowarka",
        "channel": "pl",
        "source_product_id": "3329422",
        "pricing_enabled": true,
        "verified": false
      },
      {
        "source": "cyberport",
        "channel": "de",
        "source_product_id": "2002-5GZ",
        "pricing_enabled": true,
        "verified": false
      },
      {
        "source": "geizhals",
        "channel": "de",
        "source_product_id": "3329422",
        "pricing_enabled": true,
        "verified": false
      },
      {
        "source": "gigantec",
        "channel": "es",
        "source_product_id": "28122",
        "pricing_enabled": true,
        "verified": false
      },
      {
        "source": "globaldata",
        "channel": "pt",
        "source_product_id": "BX80768265KF",
        "pricing_enabled": true,
        "verified": false
      },
      {
        "source": "jimms-pc",
        "channel": "fi",
        "source_product_id": "205709",
        "pricing_enabled": true,
        "verified": false
      },
      {
        "source": "laptop-outlet",
        "channel": "uk",
        "source_product_id": "BX80768265KF",
        "pricing_enabled": true,
        "verified": false
      },
      {
        "source": "mwave",
        "channel": "au",
        "source_product_id": "AC78463",
        "pricing_enabled": true,
        "verified": false
      },
      {
        "source": "neobyte",
        "channel": "es",
        "source_product_id": "CP01IN193",
        "pricing_enabled": true,
        "verified": false
      },
      {
        "source": "newegg",
        "channel": "ca",
        "source_product_id": "N82E16819118507",
        "pricing_enabled": true,
        "verified": true
      },
      {
        "source": "newegg",
        "channel": "us",
        "source_product_id": "N82E16819118507",
        "pricing_enabled": true,
        "verified": true
      },
      {
        "source": "overclockers",
        "channel": "uk",
        "source_product_id": "PRO-INT-03112",
        "pricing_enabled": true,
        "verified": false
      },
      {
        "source": "paradigit",
        "channel": "ie",
        "source_product_id": "80067638",
        "pricing_enabled": true,
        "verified": false
      },
      {
        "source": "paradigit",
        "channel": "nl",
        "source_product_id": "80067638",
        "pricing_enabled": true,
        "verified": false
      },
      {
        "source": "proshop",
        "channel": "de",
        "source_product_id": "3295791",
        "pricing_enabled": true,
        "verified": false
      },
      {
        "source": "proshop",
        "channel": "fi",
        "source_product_id": "3295791",
        "pricing_enabled": true,
        "verified": false
      },
      {
        "source": "proshop",
        "channel": "nl",
        "source_product_id": "3295791",
        "pricing_enabled": true,
        "verified": false
      },
      {
        "source": "proshop",
        "channel": "pl",
        "source_product_id": "3295791",
        "pricing_enabled": true,
        "verified": false
      },
      {
        "source": "quzo",
        "channel": "uk",
        "source_product_id": "390548",
        "pricing_enabled": true,
        "verified": false
      },
      {
        "source": "ruedecommerce",
        "channel": "fr",
        "source_product_id": "AR202409200036",
        "pricing_enabled": true,
        "verified": false
      },
      {
        "source": "scan-computer",
        "channel": "uk",
        "source_product_id": "151394",
        "pricing_enabled": true,